{
  "$schema": "https://json-schema.org/draft/2020-12/schema",
  "title": "LeewayPB session export v1",
  "type": "object",
  "additionalProperties": false,
  "properties": {
    "format": {
      "const": "leewaypb.session-export"
    },
    "schemaVersion": {
      "const": 1
    },
    "sourceApp": {
      "const": "pickle-point"
    },
    "sourceInstanceId": {
      "type": "string",
      "format": "uuid",
      "pattern": "^[0-9a-fA-F]{8}-[0-9a-fA-F]{4}-4[0-9a-fA-F]{3}-[89abAB][0-9a-fA-F]{3}-[0-9a-fA-F]{12}$"
    },
    "exportedAt": {
      "type": "string",
      "format": "date-time",
      "pattern": "^\\d{4}-\\d{2}-\\d{2}T\\d{2}:\\d{2}:\\d{2}\\.\\d{3}Z$"
    },
    "sessions": {
      "type": "array",
      "items": {
        "type": "object",
        "additionalProperties": false,
        "properties": {
          "id": {
            "type": "string",
            "pattern": "^[a-zA-Z0-9_-]{1,100}$"
          },
          "revision": {
            "type": "integer",
            "minimum": 1,
            "maximum": 9007199254740991
          },
          "updatedAt": {
            "type": "string",
            "format": "date-time",
            "pattern": "^\\d{4}-\\d{2}-\\d{2}T\\d{2}:\\d{2}:\\d{2}\\.\\d{3}Z$"
          },
          "status": {
            "const": "completed"
          },
          "start": {
            "type": "string",
            "format": "date-time",
            "pattern": "^\\d{4}-\\d{2}-\\d{2}T\\d{2}:\\d{2}:\\d{2}\\.\\d{3}Z$"
          },
          "end": {
            "type": "string",
            "format": "date-time",
            "pattern": "^\\d{4}-\\d{2}-\\d{2}T\\d{2}:\\d{2}:\\d{2}\\.\\d{3}Z$"
          },
          "timezone": {
            "type": "string",
            "minLength": 1
          },
          "notes": {
            "type": "string"
          },
          "context": {
            "type": "object",
            "additionalProperties": false,
            "properties": {
              "location": {
                "type": "string"
              },
              "ball": {
                "type": "string"
              },
              "weather": {
                "type": "string"
              },
              "netType": {
                "type": "string"
              },
              "environment": {
                "enum": [
                  "indoor",
                  "outdoor",
                  "unknown"
                ]
              }
            },
            "required": []
          },
          "timeBasis": {
            "enum": [
              "recorded-play",
              "session-elapsed",
              "unknown"
            ]
          },
          "playIntervals": {
            "anyOf": [
              {
                "type": "null"
              },
              {
                "type": "array",
                "minItems": 1,
                "items": {
                  "type": "object",
                  "additionalProperties": false,
                  "properties": {
                    "id": {
                      "type": "string",
                      "pattern": "^[a-zA-Z0-9_-]{1,100}$"
                    },
                    "start": {
                      "type": "string",
                      "format": "date-time",
                      "pattern": "^\\d{4}-\\d{2}-\\d{2}T\\d{2}:\\d{2}:\\d{2}\\.\\d{3}Z$"
                    },
                    "end": {
                      "type": "string",
                      "format": "date-time",
                      "pattern": "^\\d{4}-\\d{2}-\\d{2}T\\d{2}:\\d{2}:\\d{2}\\.\\d{3}Z$"
                    },
                    "paddleRef": {
                      "anyOf": [
                        {
                          "type": "null"
                        },
                        {
                          "type": "object",
                          "additionalProperties": false,
                          "properties": {
                            "id": {
                              "type": "string",
                              "pattern": "^[a-zA-Z0-9_-]{1,100}$"
                            },
                            "label": {
                              "type": "string",
                              "minLength": 1
                            }
                          },
                          "required": [
                            "id",
                            "label"
                          ]
                        }
                      ]
                    }
                  },
                  "required": [
                    "id",
                    "start",
                    "end"
                  ]
                }
              }
            ]
          }
        },
        "required": [
          "id",
          "revision",
          "updatedAt",
          "status",
          "start",
          "end",
          "timeBasis",
          "playIntervals"
        ],
        "allOf": [
          {
            "if": {
              "properties": {
                "timeBasis": {
                  "const": "recorded-play"
                }
              }
            },
            "then": {
              "properties": {
                "playIntervals": {
                  "type": "array",
                  "minItems": 1
                }
              }
            },
            "else": {
              "properties": {
                "playIntervals": {
                  "type": "null"
                }
              }
            }
          }
        ]
      }
    }
  },
  "required": [
    "format",
    "schemaVersion",
    "sourceApp",
    "sourceInstanceId",
    "exportedAt",
    "sessions"
  ]
}
