{
  "format": "leewaypb.session-export",
  "schemaVersion": 1,
  "sourceApp": "pickle-point",
  "sourceInstanceId": "c7b6215c-9b23-4a33-9ae7-d7c5a44ee625",
  "exportedAt": "2026-10-05T18:00:00.000Z",
  "sessions": [
    {
      "id": "session-multi-paddle",
      "revision": 1,
      "updatedAt": "2026-10-05T18:00:00.000Z",
      "status": "completed",
      "start": "2026-10-04T23:30:00.000Z",
      "end": "2026-10-05T01:00:00.000Z",
      "timezone": "America/New_York",
      "timeBasis": "recorded-play",
      "playIntervals": [
        {
          "id": "interval-1",
          "start": "2026-10-04T23:35:00.000Z",
          "end": "2026-10-05T00:00:00.000Z",
          "paddleRef": {
            "id": "paddle-1",
            "label": "Blue court paddle"
          }
        },
        {
          "id": "interval-2",
          "start": "2026-10-05T00:10:00.000Z",
          "end": "2026-10-05T00:45:00.000Z",
          "paddleRef": {
            "id": "paddle-2",
            "label": "Control paddle"
          }
        }
      ]
    }
  ]
}
